{"audit_binding":{"audit_id":"native-audit-c752652ee8c277c3c8299d11faf053a0","audit_integrity_sha256":"7b8f24843468bbec87c3158b3da14df730df5b8dc8742e536e27d2d212fd590c"},"created_at":"2026-08-05T17:44:16Z","integrity":{"algorithm":"SHA-256","sha256":"f1663e4ae147a5e85b23d72e0f4afbf32e4f9aa8f2b0d776078822d4eb7b3299"},"intent_id":"native-intent-282bcbc3f0a34a8a4ac6f00c276fcf66","operations":[{"delta":["3ff0000000000000","0000000000000000","0000000000000000"],"kind":"translate_dbtext","operation_id":"native-operation-aaaaaaaaaaaaaaaaaaaaaaaa","target_id":"native-target-635e3457576b2b313786bb9e"}],"schema_version":"liang-pingfa/native-edit-intent/v1"}
